Open to discussing flexible working arrangements at the interview stage?,Yes
Employer is a Pay Equity Ambassador*,No
Paid Parental Leave at full salary for primary carer (not including government-funded parental leave),12 Weeks
Paid Parental Leave at full salary for secondary carer,None **
Minimum tenure required to be eligible for Paid Parental Leave,12 months
Continuation of superannuation payments whilst on paid Parental Leave,Yes
Continuation of superannuation payments whilst on unpaid Parental Leave,No
Programs for parents returning to work after Parental Leave,Yes
Opportunities to purchase leave,Yes
Employee Assistance Program (EAP),Yes
Breastfeeding rooms,Yes
Leadership development programs,Yes
Mentoring opportunities,Yes
Coaching programs,Yes
Targets to raise the number of women in leadership,20:80 by 2020
Domestic and Family Violence policy,Yes
Internal Women's networking groups,Yes
Employee engagement scores year on year,MEI 2018: 68%
Employee turnover rate,6.1%
Paid volunteer days,Not Available